{
  "evidence_format": "ock.evidence/1",
  "task_id": "D0.03",
  "run_id": "20260907T064506Z-b541b4c77d61",
  "started_at": "2026-09-07T06:45:06.351908+00:00",
  "source": {
    "commit": "bf122b786027f7d0a4fc13cb3454d4acc13940ca",
    "dirty": true,
    "root": "E:\\VS2019Qt5.15\\3D",
    "inputs": [
      {
        "path": "cmake/Dependencies.cmake",
        "sha256": "c54d31ecd67b89b57ef6f246c2ad49dc502990a7560bea41cc1a14502effd8d7",
        "size": 5941
      },
      {
        "path": "cmake/DependencyProbes.cmake",
        "sha256": "ebcc48ac4d7b3f2cc171544672baae567a71c918e73f3ef5579cbc90ac7006ff",
        "size": 3133
      },
      {
        "path": "cmake/OCKConfig.cmake.in",
        "sha256": "fad378bb872aa1226b9ad6befa2ec6e90f3b6dbf15b8bb69c6b5ddf5f76119d1",
        "size": 539
      },
      {
        "path": "cmake/TargetDependencies.cmake",
        "sha256": "c71fdedbc4b0ab92db0d625c12a130d6184a554462f4db9ad50613e75effa630",
        "size": 3871
      },
      {
        "path": "CMakeLists.txt",
        "sha256": "ca6a9052e5feff70cfed14ee1f774b181dc2ed99e0a1a9ee0ecd1f2cf85fc4ac",
        "size": 4692
      },
      {
        "path": "CMakePresets.json",
        "sha256": "1470046858bf0f639f733091308a768de2cf96b8d9f3c74358186d9b14211836",
        "size": 2797
      },
      {
        "path": "dependencies.lock",
        "sha256": "e6ee3e75590bb5d7d8fcf8d133fd237f823f496512444a0cc344684c88c492e7",
        "size": 12593
      },
      {
        "path": "docs/01_Architecture_v3.3.md",
        "sha256": "f20644428ed8c307109e26fe690e951f7e191659903bb496ba8dee51125bca2d",
        "size": 117323
      },
      {
        "path": "docs/02_Execution_Plan_v3.3.md",
        "sha256": "7daf3c8a7e68462a97cd593d2ab9a35c1888b720428c72bc9f915049050df511",
        "size": 107799
      },
      {
        "path": "docs/adr/ADR-human-ui-and-optional-dsl.md",
        "sha256": "3055cea69d53003dc2a6a261c1bb4d1424acd9c6d59caae94ecc9a3048ef110d",
        "size": 658
      },
      {
        "path": "docs/adr/ADR-no-generic-state-rpc.md",
        "sha256": "c461c37b233c917c5af1e0215c0d60a9251f32d8d4cd5fea215dcc0777d308ad",
        "size": 657
      },
      {
        "path": "docs/adr/ADR-ui-operation-surface.md",
        "sha256": "f57da419f0278eb58819822d835f428148ad1b2326f79af2695356378d09e27a",
        "size": 672
      },
      {
        "path": "docs/adr/README.md",
        "sha256": "1c86d558321a28776707c836d9b3af579fa10545c7f9f7c45f0efe596e9420c4",
        "size": 1031
      },
      {
        "path": "docs/consumer-targets.md",
        "sha256": "8cfa604d6e3d7141aa13874fe5510ad98a0ef12f1e4fbd12ccd667e4c1756156",
        "size": 2089
      },
      {
        "path": "docs/contracts/commit.md",
        "sha256": "44a3a743889b3e9f8fb6513085c97583008c38c045de4554793698ba2da89714",
        "size": 14434
      },
      {
        "path": "docs/contracts/control-observation.md",
        "sha256": "830fe3ff6c0eaf300aa35f332f4838c9462e5c1edc5fca6e577852c0bcc3b1fe",
        "size": 9299
      },
      {
        "path": "docs/contracts/cursor-v1.md",
        "sha256": "c39b4356ccf74f29bcf67281c735424710a569f307b20c061ce9f5e134f0224a",
        "size": 4402
      },
      {
        "path": "docs/contracts/intent.md",
        "sha256": "41851df8b578373870d301528442901ec02dfaad2947976fb9e73e73589d90b1",
        "size": 12862
      },
      {
        "path": "docs/contracts/outcome.md",
        "sha256": "3b9dc03049342716cc3ee7b2adbccb62e86e1bb1193470c782fb2ae2b19347dd",
        "size": 16247
      },
      {
        "path": "docs/contracts/plan.md",
        "sha256": "3dd3a15b20a68433fde32f7542fa7fa239cf55c0a810c76fa08f5ce4e82ab2a2",
        "size": 7728
      },
      {
        "path": "docs/public-headers.md",
        "sha256": "0299da1d002aae7a5b8d5a5f8661d6ac0e17c4809520897c0c372ff09f45e953",
        "size": 4864
      },
      {
        "path": "docs/requirements.md",
        "sha256": "252f1acf25fb2474cda8a06d652c360d2660abc9a74538f51408342aece8557f",
        "size": 13608
      },
      {
        "path": "docs/sdk-version-policy.md",
        "sha256": "2d797d4bd7d76231997af9f36155d2b953e0c05b5155fa3d6a15333b244086f5",
        "size": 2296
      },
      {
        "path": "docs/threat-model.md",
        "sha256": "7ca7706d8ace716e5e75005f86e5332b92be8a33c1310120159f7ed184c2af0f",
        "size": 3034
      },
      {
        "path": "docs/toolchain.md",
        "sha256": "24530acfda9de6f03717c7028e05e6c63321674e12f2e26648f8cf8f2ef2c97c",
        "size": 12539
      },
      {
        "path": "evidence/bootstrap/D0.06-a/python-lock/pypi-9c1a3f50/attrs.json",
        "sha256": "a882bf941fb4a0bb748d0194df544121cc130f5fb15a710ab6b804c17d2899b7",
        "size": 11038
      },
      {
        "path": "evidence/bootstrap/D0.06-a/python-lock/pypi-9c1a3f50/jsonschema-specifications.json",
        "sha256": "91810d8f79384375ad0c0cf631e06903e2790b030d3fad2f1ad657b20ddd839e",
        "size": 5037
      },
      {
        "path": "evidence/bootstrap/D0.06-a/python-lock/pypi-9c1a3f50/jsonschema.json",
        "sha256": "d3dbd3231e74a925ede39a13da820cd72d05d67b4d1af3f1c896c95b42794f9d",
        "size": 9752
      },
      {
        "path": "evidence/bootstrap/D0.06-a/python-lock/pypi-9c1a3f50/referencing.json",
        "sha256": "a67968d8e03aa45e650fc2ff0d07796676db1a7841ce8e810bf2dba5af689464",
        "size": 4842
      },
      {
        "path": "evidence/bootstrap/D0.06-a/python-lock/pypi-9c1a3f50/rpds-py.json",
        "sha256": "fff1fa33d84392d5684f0c1a40fc23f0a2027113c966498a1f64614bc83b02c2",
        "size": 106094
      },
      {
        "path": "evidence/bootstrap/D0.06-a/python-lock/pypi-9c1a3f50/typing-extensions.json",
        "sha256": "2140da00d62dde967f52d0be0ae28444f1d6a3fe603f52c83c23988c32122d5a",
        "size": 5631
      },
      {
        "path": "examples/plans/compute-apply.plan.json",
        "sha256": "6ad1eba9d3c637a91b813263b1fe905c281be03a4c5e41d1a879bdc671796d87",
        "size": 907
      },
      {
        "path": "examples/plans/settings-atomic.plan.json",
        "sha256": "a9e6e50e91204b8f119ce1e1d615da0877b6e80a4f163804bfd45011d3fb57b4",
        "size": 1553
      },
      {
        "path": "packages/foundation/include/ock/foundation/sdk_version.hpp",
        "sha256": "e8c742c6f8a602b1691ce1587525d885791f4b5aa0c310a6ba88ee682ebde616",
        "size": 486
      },
      {
        "path": "schemas/evidence-v1.schema.json",
        "sha256": "cc735fbeb93419ddbc3d9667c7239c9de9a237936f0d860384064485eb0b410c",
        "size": 16070
      },
      {
        "path": "schemas/outcome-v1.schema.json",
        "sha256": "999995002fa8fa245b9e2bb097617f587f422eec4e1d88927bda094db4b6a22f",
        "size": 22641
      },
      {
        "path": "schemas/plan-v1.schema.json",
        "sha256": "3a07cf8a1a4de201f25756ce780c747c2c12659e1f62ad406725c90b812805f3",
        "size": 18024
      },
      {
        "path": "schemas/rpc-v1/common.schema.json",
        "sha256": "27292f7f18010c155ce07864398a4e6d06930ccbcb973fcbf98910685bfdb2c0",
        "size": 1943
      },
      {
        "path": "schemas/rpc-v1/execution-list.schema.json",
        "sha256": "53d3e3d7f316e17c70afe6fc4b9074162cb33f4582a1d274deecb38dcb6bb8aa",
        "size": 5898
      },
      {
        "path": "schemas/rpc-v1/notifications.schema.json",
        "sha256": "f88e11256e03d9d667bf40d7bcb49eff8f8204c5259bc020222f7976f3be8644",
        "size": 13148
      },
      {
        "path": "sdk/sdk_api_manifest.json",
        "sha256": "aef0cf47c3ac3bd81f2be7069f527430a93ddc5d65047dec84d6a1cdd61a02ed",
        "size": 18218
      },
      {
        "path": "tests/architecture/test_architecture.py",
        "sha256": "4b9a3b7e667861101fac7b2478913c6e39b0e98afefdb52653978690490586dd",
        "size": 6617
      },
      {
        "path": "tests/compile/sdk_metadata.cpp",
        "sha256": "a102eaec8f57834e127fcb2b959ae876183d109dc1aa677f9e693bc7c1449065",
        "size": 275
      },
      {
        "path": "tests/conformance/README.md",
        "sha256": "94468f6ac29bd1ddf96c9cd448dfc89779f0aec1af45596e46f7511b7f5b82a2",
        "size": 950
      },
      {
        "path": "tests/conformance/run.py",
        "sha256": "bf3566cf11554314f61c707a383839e504044d74e867892e2b04ea71c29f2835",
        "size": 1786
      },
      {
        "path": "tests/conformance/support/__init__.py",
        "sha256": "e3b0c44298fc1c149afbf4c8996fb92427ae41e4649b934ca495991b7852b855",
        "size": 0
      },
      {
        "path": "tests/conformance/support/fixtures.py",
        "sha256": "5526a65ef59adffb4de6bf2b3e236e0020dddf149ac0e4de531fe084f3835b94",
        "size": 1490
      },
      {
        "path": "tests/conformance/support/harness.py",
        "sha256": "e4710e89c7f328e0646b9d4765494156da9be056487726731a3cdee4c715b280",
        "size": 5815
      },
      {
        "path": "tests/conformance/support/manifest.json",
        "sha256": "b84440c8ab8403ce557cfe68c7cf9000981e726caee8bd0c3a0f1d9b096a960d",
        "size": 1025
      },
      {
        "path": "tests/conformance/test_bootstrap.py",
        "sha256": "3dea74fef79580f5090e3faa875055f661eae7ea53dc18213187753927aed752",
        "size": 3830
      },
      {
        "path": "tests/control/__init__.py",
        "sha256": "e3b0c44298fc1c149afbf4c8996fb92427ae41e4649b934ca495991b7852b855",
        "size": 0
      },
      {
        "path": "tests/control/control_model.py",
        "sha256": "e939c80f6c4062e44f77517583f0b52c2277187ad9daa06cb21b2eaf796980f0",
        "size": 20059
      },
      {
        "path": "tests/control/golden/cursor.json",
        "sha256": "9d0ff462f7bfadea3e7eefb0e0fd6badb2676877dd4b3ec48ed55dfcfd04be52",
        "size": 2333
      },
      {
        "path": "tests/control/golden/messages.json",
        "sha256": "cc3d609ab4b5df116a3363220aa34143104605419bf3d4331ffeeb5e8ce043ad",
        "size": 12195
      },
      {
        "path": "tests/control/test_control_contract.py",